<?xml version="1.0" encoding="UTF-8"?>
<Type_0x06 messageNo="0" messageSequenceNo="0"
	messageSerialNo="0" xmlns="http://www.example.org/msg_0x06" xmlns:u="http://www.example.org/UType"
	xmlns:xsi="http://www.w3.org/2001/XMLSchema-instance"
	xsi:schemaLocation="http://www.example.org/msg_0x06 ../xsd/msg_0x06.xsd ">
	<AppType>0</AppType>
	<AppID>0</AppID>
	<AppName>tns:AppName</AppName>
	<App_Threshold_Up_ABS>0</App_Threshold_Up_ABS>
	<App_Threshold_Dn_ABS>0</App_Threshold_Dn_ABS>
	<C_TimeSlots>
		<C_TimeSlot>
			<C_Starttime>0</C_Starttime>
			<C_Stoptime>0</C_Stoptime>
		</C_TimeSlot>
		<C_TimeSlot>
			<C_Starttime>0</C_Starttime>
			<C_Stoptime>0</C_Stoptime>
		</C_TimeSlot>
	</C_TimeSlots>
	<MessageSerialNo>0</MessageSerialNo>
</Type_0x06>
